{
  "$schema": "exam-prompt-skills-v1",
  "generated": "2026-06-07T15:39:06Z",
  "total_skills": 26,
  "skills": [
    {
      "name": "universal-a-plus-answer-writer",
      "description": "Generates exam-ready A+ answers for ANY university worldwide — SPPU, VTU, IITs, NITs, MIT, Oxford, Cambridge, Harvard, NUS, and 50+ more. Covers ALL question types (theory, numerical, MCQ, case study, derivation, diagram, design, etc.), ALL mark levels (1-100+), ALL exam conditions (closed/open book, online, oral, lab, take-home), ALL Bloom's levels, and ALL command words. Pre-configured with SPPU Computer Engineering intelligence. Universally adaptable via syllabus PDF input. Trigger on ANY exam answer request. Never trigger for lab practical reports, project documentation, or coding assignments unless asked.\n",
      "version": "1.0.0",
      "directory": "answer-writer",
      "skill_path": "skills/answer-writer/SKILL.md"
    },
    {
      "name": "universal-assignment-writer",
      "description": "Generates assignment-ready content for any university worldwide across all assignment types (theory, numerical, case study, research, literature review, project proposals, design, analysis, comparison, critical review, problem-solving, and diagram/illustration). Supports multiple output formats, evaluation depth mapping, marking scheme generation, and citation requirements. University-agnostic.\n",
      "version": "1.0.0",
      "directory": "assignment-writer",
      "skill_path": "skills/assignment-writer/SKILL.md"
    },
    {
      "name": "universal-case-study-solver",
      "description": "Solves ANY case study type for ANY university worldwide. Covers business, engineering, medical, legal, ethical, social science, and technical case studies. Uses structured frameworks (SWOT, PESTEL, 5 Whys, Root Cause Analysis, Ethical Matrix, Fishbone, etc.) with per-section marking allocation.",
      "version": "1.0.0",
      "directory": "case-study-solver",
      "skill_path": "skills/case-study-solver/SKILL.md"
    },
    {
      "name": "universal-cross-subject-mapper",
      "description": "Maps conceptual connections across subjects for ANY university worldwide. Shows how topics from one course relate to and build upon topics from other courses. Provides integrated learning paths, dependency graphs, and cross-referenced study materials. Essential for comprehensive exams and interdisciplinary understanding.",
      "version": "1.0.0",
      "directory": "cross-subject-mapper",
      "skill_path": "skills/cross-subject-mapper/SKILL.md"
    },
    {
      "name": "universal-diagram-generator",
      "description": "Generates professional diagrams (flowcharts, mind maps, architecture, UML, graphs) from Mermaid, D2, and Graphviz code. Renders to SVG for GitHub Markdown and embeds into PDFs automatically. Supports ALL diagram types for ANY university, ANY subject.",
      "version": "1.0.0",
      "directory": "diagram-generator",
      "skill_path": "skills/diagram-generator/SKILL.md"
    },
    {
      "name": "universal-document-generator",
      "description": "Converts Markdown study content to print-ready PDF documents with professional formatting. Covers full pipeline from source PDFs to clean text to Markdown notes to PDF output. Works for ANY university, ANY subject. Trigger on requests to generate PDFs from Markdown, create printable study materials, or batch-convert notes to PDF.\n",
      "version": "1.0.0",
      "directory": "document-generator",
      "skill_path": "skills/document-generator/SKILL.md"
    },
    {
      "name": "universal-essay-grader",
      "description": "Scores and evaluates student answers against university-specific rubrics for ANY university worldwide. Covers ALL question types, ALL mark ranges (1-100+), ALL Bloom's levels. Provides detailed feedback per evaluation criterion with improvement suggestions and model answer comparison.",
      "version": "1.0.0",
      "directory": "essay-grader",
      "skill_path": "skills/essay-grader/SKILL.md"
    },
    {
      "name": "universal-exam-paper-generator",
      "description": "Generates exam-ready question papers for ANY university worldwide. Supports 11+ university patterns (SPPU, VTU, JNTU, Mumbai, AKTU, RGPV, IIT/NIT, North American, UK/Oxford/Cambridge, Generic), 13 question types, CO/Bloom mapping, marking schemes, and model answer keys.\n",
      "version": "1.0.0",
      "directory": "exam-paper-generator",
      "skill_path": "skills/exam-paper-generator/SKILL.md"
    },
    {
      "name": "universal-flashcard-generator",
      "description": "Converts any study material (notes, textbooks, syllabus topics, PYQs) into optimized flashcards for ANY university worldwide. Supports 6 flashcard types across 3 difficulty tiers with built-in Spaced Repetition System (SRS) metadata. Exports to Anki, Quizlet, CSV, and text formats. Works for ALL subjects, ALL departments.",
      "version": "1.0.0",
      "directory": "flashcard-generator",
      "skill_path": "skills/flashcard-generator/SKILL.md"
    },
    {
      "name": "universal-formula-sheet-generator",
      "description": "Generates compact, exam-ready formula sheets for ANY university worldwide. Covers engineering, mathematics, physics, chemistry, finance, statistics, and data science. Organized by unit with variable definitions, SI units, and quick-reference annotations. Optimized for closed-book recall and open-book quick lookup.",
      "version": "1.0.0",
      "directory": "formula-sheet-generator",
      "skill_path": "skills/formula-sheet-generator/SKILL.md"
    },
    {
      "name": "universal-imp-topics-generator",
      "description": "Generates high-probability IMP topics, exam-relevant questions grouped by marks/unit, time-optimized preparation strategies, and emergency plans for ANY university worldwide. Trigger when user asks for important topics, IMP questions, exam strategy, \"what to study\", high-weightage topics, or last-minute preparation plans. Requires PYQ PDFs and syllabus as input. Never generates answers or teaches concepts. Works for all universities: SPPU, VTU, JNTU, RGPV, PU, DU, IPU, API Abdulkalam, UPTU, GTU, BPUT, and any international university following a semester/year exam pattern.\n",
      "version": "1.0.0",
      "directory": "imp-topics-generator",
      "skill_path": "skills/imp-topics-generator/SKILL.md"
    },
    {
      "name": "universal-lab-report-writer",
      "description": "Generates complete laboratory report structures for ANY university worldwide. Covers engineering, science, medical, and research labs. Provides full templates including aim, apparatus, theory, procedure, observations, calculations, results, discussion, and conclusions. Adapts to any university's lab report format requirements.",
      "version": "1.0.0",
      "directory": "lab-report-writer",
      "skill_path": "skills/lab-report-writer/SKILL.md"
    },
    {
      "name": "universal-last-minute-crammer",
      "description": "Emergency exam preparation system for ANY university worldwide. Generates ultra-compressed study plans for 12-hour, 6-hour, 3-hour, and 1-hour timeframes. Uses rapid memory encoding techniques (memory palace, chunking, peg system, acronym chains) for maximum retention in minimum time. Covers ALL subjects, ALL exam types.",
      "version": "1.0.0",
      "directory": "last-minute-crammer",
      "skill_path": "skills/last-minute-crammer/SKILL.md"
    },
    {
      "name": "universal-mcq-practice-generator",
      "description": "Generates exam-style multiple choice questions for ANY university worldwide. Covers ALL question patterns (single correct, multiple correct, assertion-reason, match-the-following, true/false, fill-in-the-blank). Adapts difficulty by Bloom's level and provides detailed answer explanations. Works for ALL subjects and ALL exam patterns.",
      "version": "1.0.0",
      "directory": "mcq-practice-generator",
      "skill_path": "skills/mcq-practice-generator/SKILL.md"
    },
    {
      "name": "universal-mind-map-generator",
      "description": "Generates visual concept maps and mind maps for ANY university worldwide. Connects topics hierarchically with cross-links, color coding by Bloom's level, and priority annotations. Supports Mermaid syntax, text outline, and image description formats. Works for ALL subjects and ALL exam patterns.",
      "version": "1.0.0",
      "directory": "mind-map-generator",
      "skill_path": "skills/mind-map-generator/SKILL.md"
    },
    {
      "name": "universal-notes-generator",
      "description": "Generates syllabus-locked, exam-ready academic notes for ANY university worldwide. Supports 12+ note formats with automatic format selection based on subject type, exam conditions, time available, and learning style. Works across all departments, disciplines, and degree programs.",
      "version": "1.0.0",
      "directory": "notes-generator",
      "skill_path": "skills/notes-generator/SKILL.md"
    },
    {
      "name": "universal-pyq-analyzer",
      "description": "Analyzes Previous Year Question Papers (PYQs) and official syllabus from ANY university worldwide to generate high-probability exam topics, question patterns, unit-wise trends, Bloom's distribution, marks analysis, CO/outcome mapping, and exam strategy. Trigger when user asks to analyze PYQs, find important topics, understand exam patterns, or wants strategic preparation guidance. Requires PYQ PDFs and syllabus as input. Never generates answers or teaches concepts.\n",
      "version": "1.0.0",
      "directory": "pyq-analyzer",
      "skill_path": "skills/pyq-analyzer/SKILL.md"
    },
    {
      "name": "universal-qp-fetcher",